{
  "schemaVersion": 1,
  "kind": "INTENTOS_BL2_DISPOSITION",
  "requirementId": "bl2:web-app-industrial:form-interaction:destructive-action-and-recovery-evidence",
  "packId": "web-app-industrial",
  "evidenceType": "form-interaction",
  "requirement": "destructive action and recovery evidence",
  "disposition": "NOT_APPLICABLE",
  "selectedProfiles": [
    "web-app"
  ],
  "scope": "The selected browser slice contains a read-only resource loader and a non-destructive filter form.",
  "basis": "The current project specification explicitly excludes destructive actions, so this slice has no destructive form interaction or destructive recovery path to verify.",
  "projectEvidence": [
    {
      "path": "specs/001-web-runtime-quality.md",
      "sha256": "sha256:e88a50e2e761b68afc1a78fc3a53efa030c89222f13388caeec5ed16b96e783f",
      "claim": "The current specification limits the form to filtering and explicitly lists destructive action as a non-goal."
    }
  ],
  "reviewTriggers": [
    "PROFILE_CHANGE",
    "PROJECT_SCOPE_CHANGE",
    "REQUIREMENT_CHANGE",
    "PROJECT_EVIDENCE_CHANGE"
  ],
  "determinedBy": "CODEX_PROJECT_EVIDENCE"
}
